CODE,NAME,GROUPING,CATEGORY,PRICE,COMMENT,URL
18,Neymar hopes his side still can win the world cup,A,2,0,Neymar hopes Brazilian team can win the world cup without him.,/media/images/neymar_1.jpg
17,Injured Neymar out of World Cup,A,2,0,Brazil forward Neymar has been ruled out of the World Cup with a broken bone in his back sustained in the 2-1 quarter-final win over Colombia.,/media/images/neymar.jpg
14,A Creative Algeria Surprises but Cannot Defeat Germany,A,2,0,Algeria!,/media/images/germanycup-master675.jpg
15,Draft no1,A,1,0,Canadian boy got no1 place,/media/images/wiggins.jpg
16,サイトのbackgroundイメージが変わる,A,3,0,ニュースサイトのbackgroundイメージがこの画面になる。,/media/images/background.jpg
11,France,A,2,0,Predicting the France Squad 60 Days from the 2014 World Cup. Christophe Ena France line up for the friendly against Netherlands.,/media/images/france.jpg
12,Gerrard retires,A,2,0,Gerrard retired.,/media/images/gerrard.jpg
13,LeBron did triple double,A,1,0,Superstar LeBron James record another triple double in last night at MIAMI,/media/images/lebron.jpg
10,Suarez banned for 9 international game,A,2,0,Luis Suárez suspended for nine matches and banned for four months from any football-related activity,/media/images/suarez.jpg
